{
  "package": "Package G — Review Decision + Publication Gate",
  "package_version": "0.1.0",
  "schema_version": "1.0.0",
  "created_at": "2026-08-30",
  "source_review_package": "data/candidates/package-f-review-queue.v0.1.json",
  "baseline_record_count": 19,
  "scope_rule": "Only the fixed 19 Package F records are in scope. Package G records governance state; it does not add candidates, alter evidence conclusions, publish records, or begin Experiment 003.",
  "governance": {
    "decision_states": [
      "pending",
      "reviewed",
      "needs_evidence",
      "rejected"
    ],
    "decision_reason_requirements": {
      "reviewed": "Require a named reviewer, date, substantive rationale, every evidence-standard check, and no unresolved evidence blocker.",
      "needs_evidence": "Require a named reviewer, date, explicit evidence-gap reason code, substantive rationale, and remediation request.",
      "rejected": "Require a named reviewer, date, explicit rejection reason code, substantive rationale, and preserved counterevidence."
    },
    "reviewed_is_not_published": true,
    "publication_requires_explicit_human_approval": true,
    "automatic_review_allowed": false,
    "automatic_publication_allowed": false
  },
  "status_summary": {
    "package_f_intake": {
      "candidate": 10,
      "needs_evidence": 9
    },
    "human_decisions": {
      "pending": 19,
      "reviewed": 0,
      "needs_evidence": 0,
      "rejected": 0
    },
    "publication_gate": {
      "not_eligible": 19,
      "eligible": 0,
      "published": 0
    }
  },
  "records": [
    {
      "candidate_id": "CAND-en-time-001",
      "source_word": "time",
      "normalized_form": "time",
      "package_f_source": {
        "package": "Package F — Candidate Source Verification + Human Review",
        "package_version": "0.1.0",
        "intake_status": "candidate",
        "provisional_reason": "The selected ordinary temporal sense is directly represented, but time is highly polysemous.",
        "source_verification_count": 3,
        "source_record_locator": "data/candidates/package-f-review-queue.v0.1.json#CAND-en-time-001"
      },
      "evidence_completeness": {
        "status": "awaiting_human_confirmation",
        "checks": [
          {
            "check_id": "fixed_candidate_identity",
            "label": "Candidate ID and source word match the fixed Package E/F queue.",
            "complete": true,
            "basis": "CAND-en-time-001"
          },
          {
            "check_id": "traceable_source_packet",
            "label": "At least three source verifications include locators, limits, access dates, and version details.",
            "complete": true,
            "basis": "3 source verifications"
          },
          {
            "check_id": "four_evidence_tracks",
            "label": "The four evidence tracks are present and separately labeled.",
            "complete": true,
            "basis": "linguistic_etymological, phonetic, semantic_cognitive, speculative_association"
          },
          {
            "check_id": "counterevidence_retained",
            "label": "Counterexamples, uncertainty, and conflicts remain visible.",
            "complete": true,
            "basis": "3 retained statements"
          },
          {
            "check_id": "sense_and_part_of_speech_resolved",
            "label": "The sense and part of speech have no unresolved Package F blocker.",
            "complete": true,
            "basis": "Package F marks the source packet Candidate-ready for human review."
          },
          {
            "check_id": "signed_human_confirmation",
            "label": "A named human reviewer completed and signed all review checks.",
            "complete": false,
            "basis": "No human reviewer or signature is recorded."
          }
        ],
        "missing_required_checks": [
          "signed_human_confirmation"
        ],
        "reviewed_eligible": false,
        "eligibility_reason": "The source packet is prepared, but the unsigned human checklist blocks Reviewed."
      },
      "decision_record": {
        "decision_id": "DEC-CAND-en-time-001-001",
        "status": "pending",
        "status_reason": "The Package F source packet is prepared, but no named human reviewer has signed a decision or completed the evidence-standard checklist.",
        "reason_codes": [
          "awaiting_human_review"
        ],
        "rationale": null,
        "remediation_required": [],
        "reviewer": null,
        "decided_at": null,
        "evidence_standard": "Package G reviewed-evidence standard v0.1",
        "checklist": [
          {
            "check_id": "source_availability_confirmed",
            "label": "Confirm every required source locator is available and matches the recorded sense.",
            "complete": false,
            "evidence_reference": null
          },
          {
            "check_id": "sense_and_part_of_speech_confirmed",
            "label": "Confirm a single reviewable sense and part of speech, or document an explicit split.",
            "complete": false,
            "evidence_reference": null
          },
          {
            "check_id": "bilingual_context_confirmed",
            "label": "Confirm the Chinese and French forms with context-sensitive examples.",
            "complete": false,
            "evidence_reference": null
          },
          {
            "check_id": "counterevidence_reviewed",
            "label": "Review and retain counterexamples, uncertainty, and conflicting evidence.",
            "complete": false,
            "evidence_reference": null
          },
          {
            "check_id": "evidence_tracks_confirmed",
            "label": "Confirm all four evidence-track labels and their stated limitations.",
            "complete": false,
            "evidence_reference": null
          },
          {
            "check_id": "claim_boundary_confirmed",
            "label": "Confirm that lexical equivalence is not presented as cognacy or a universal law.",
            "complete": false,
            "evidence_reference": null
          }
        ]
      },
      "publication_gate": {
        "eligibility_status": "not_eligible",
        "eligibility_reason": "A signed Reviewed decision, completed release checklist, and explicit publication approval are absent.",
        "checklist": [
          {
            "check_id": "signed_reviewed_decision",
            "label": "A named human reviewer signed a Reviewed decision.",
            "complete": false,
            "evidence_reference": null
          },
          {
            "check_id": "reviewed_gate_passed",
            "label": "Every Reviewed evidence-standard check passed without an unresolved blocker.",
            "complete": false,
            "evidence_reference": null
          },
          {
            "check_id": "canonical_record_prepared",
            "label": "A normalized canonical record and provenance references were prepared.",
            "complete": false,
            "evidence_reference": null
          },
          {
            "check_id": "canonical_validation_passed",
            "label": "Canonical schema, dataset, and regression validation passed.",
            "complete": false,
            "evidence_reference": null
          },
          {
            "check_id": "release_audit_linked",
            "label": "The release change is linked to the review decision and audit history.",
            "complete": false,
            "evidence_reference": null
          },
          {
            "check_id": "explicit_publication_approval",
            "label": "A named human publisher explicitly approved publication.",
            "complete": false,
            "evidence_reference": null
          }
        ],
        "approval": {
          "publisher": null,
          "approved_at": null,
          "rationale": null,
          "release_commit": null
        },
        "publication_status": "not_published",
        "automatic_promotion_allowed": false
      },
      "audit_log": [
        {
          "event_id": "AUD-CAND-en-time-001-001",
          "occurred_at": "2026-08-30",
          "event_type": "decision_gate_initialized",
          "actor": {
            "actor_type": "system",
            "actor_id": "package-g-builder"
          },
          "from_state": {
            "intake_status": "candidate",
            "decision_status": null,
            "publication_status": "not_published"
          },
          "to_state": {
            "intake_status": "candidate",
            "decision_status": "pending",
            "publication_status": "not_published"
          },
          "reason_code": "awaiting_human_review",
          "rationale": "Initialized governance fields without making, signing, or publishing a human decision.",
          "source_references": [
            "data/candidates/package-f-review-queue.v0.1.json#CAND-en-time-001"
          ]
        }
      ]
    },
    {
      "candidate_id": "CAND-en-space-001",
      "source_word": "space",
      "normalized_form": "space",
      "package_f_source": {
        "package": "Package F — Candidate Source Verification + Human Review",
        "package_version": "0.1.0",
        "intake_status": "candidate",
        "provisional_reason": "The ordinary spatial sense is supported; outer space, blank space, and available-room senses must remain separate.",
        "source_verification_count": 3,
        "source_record_locator": "data/candidates/package-f-review-queue.v0.1.json#CAND-en-space-001"
      },
      "evidence_completeness": {
        "status": "awaiting_human_confirmation",
        "checks": [
          {
            "check_id": "fixed_candidate_identity",
            "label": "Candidate ID and source word match the fixed Package E/F queue.",
            "complete": true,
            "basis": "CAND-en-space-001"
          },
          {